ean,sku,quantity,price,condition,notes,seller
9781472579508,3-F-2-0034,1,72.59,Very Good,Used - Very Good,Black Hand Books
9781284034165,SAV-093-978:SAV,1,39.11,Good,3rd Edition. Used books are NOT guaranteed to contain components and/or supplements such as: Access Codes or working CD's/DVD's! Ships fast! Expedited shipping 2-4 business days; Standard shipping 7-14 business days. Ships from USA!,Texas Enterprise
9780789487971,363875,1,15.98,Like New,"Trade paperback. Near Fine condition; edges, corners, and covers of book show very minor wear. No underlining; no highlighting; no internal markings. No pricing stickers. No remainder mark. ""Art History & Art 10182014"" Stored in sealed plastic protection. In the event of a problem we guarantee full refund. 2002. Trade paperback.",BookZoneUSA
9780691016177,F-04-0990,1,41.98,Very Good,"Dust Jacket in Very Good Condition. Hardcover A well-cared-for item that has seen limited use but remains in very good condition. The item is complete, and without noticable damage. It may have limited signs of use. Packed with care, shipped promptly.",St Vincent De Paul
9780312602970,WAL-D-0h-000529,1,1.15,Good,"A sound copy with only light wear. Overall a solid copy at a great price! All orders guaranteed and ship within 24 hours. Your purchase supports More Than Words, a nonprofit job training program for youth, empowering youth to take charge of their lives by taking charge of a business.",More Than Words
